{
  "schema": "TSAO-EPDM-V2-GENERATED-STATE-DEFINITION-1",
  "generated_state_definition_id": "STATE-EXTENSIVE-L2-1:L2:GENERATED",
  "source_state_definition_id": "STATE-EXTENSIVE-L2-1",
  "source_catalog_schema": "TSAO-EPDM-V2-STATE-CATALOG-1",
  "version": "2.1.0",
  "model_level": 2,
  "basis": "EXTENSIVE_REACTOR_AMOUNT",
  "energy_formulation": "ISOTHERMAL",
  "site_family_ids": [
    "SITE-A"
  ],
  "terminal_ids": [
    "E",
    "P",
    "D"
  ],
  "variables": [
    {
      "state_id": "N_E",
      "base_variable_id": "N_E",
      "index": 0,
      "unit": "mol",
      "basis": "EXTENSIVE_REACTOR_AMOUNT",
      "model_level": 1,
      "site_family_id": null,
      "terminal_id": null,
      "nonnegative": true,
      "conserved_inventory_id": null
    },
    {
      "state_id": "N_P",
      "base_variable_id": "N_P",
      "index": 1,
      "unit": "mol",
      "basis": "EXTENSIVE_REACTOR_AMOUNT",
      "model_level": 1,
      "site_family_id": null,
      "terminal_id": null,
      "nonnegative": true,
      "conserved_inventory_id": null
    },
    {
      "state_id": "N_D",
      "base_variable_id": "N_D",
      "index": 2,
      "unit": "mol",
      "basis": "EXTENSIVE_REACTOR_AMOUNT",
      "model_level": 1,
      "site_family_id": null,
      "terminal_id": null,
      "nonnegative": true,
      "conserved_inventory_id": null
    },
    {
      "state_id": "N_H2",
      "base_variable_id": "N_H2",
      "index": 3,
      "unit": "mol",
      "basis": "EXTENSIVE_REACTOR_AMOUNT",
      "model_level": 1,
      "site_family_id": null,
      "terminal_id": null,
      "nonnegative": true,
      "conserved_inventory_id": null
    },
    {
      "state_id": "N_SOLVENT",
      "base_variable_id": "N_SOLVENT",
      "index": 4,
      "unit": "mol",
      "basis": "EXTENSIVE_REACTOR_AMOUNT",
      "model_level": 1,
      "site_family_id": null,
      "terminal_id": null,
      "nonnegative": true,
      "conserved_inventory_id": null
    },
    {
      "state_id": "N_COCATALYST",
      "base_variable_id": "N_COCATALYST",
      "index": 5,
      "unit": "mol",
      "basis": "EXTENSIVE_REACTOR_AMOUNT",
      "model_level": 1,
      "site_family_id": null,
      "terminal_id": null,
      "nonnegative": true,
      "conserved_inventory_id": null
    },
    {
      "state_id": "N_POISON",
      "base_variable_id": "N_POISON",
      "index": 6,
      "unit": "mol",
      "basis": "EXTENSIVE_REACTOR_AMOUNT",
      "model_level": 1,
      "site_family_id": null,
      "terminal_id": null,
      "nonnegative": true,
      "conserved_inventory_id": null
    },
    {
      "state_id": "N_SITE_POTENTIAL:SITE-A",
      "base_variable_id": "N_SITE_POTENTIAL",
      "index": 7,
      "unit": "mol",
      "basis": "EXTENSIVE_REACTOR_AMOUNT",
      "model_level": 2,
      "site_family_id": "SITE-A",
      "terminal_id": null,
      "nonnegative": true,
      "conserved_inventory_id": "SITE_TOTAL:SITE-A"
    },
    {
      "state_id": "N_SITE_VACANT:SITE-A",
      "base_variable_id": "N_SITE_VACANT",
      "index": 8,
      "unit": "mol",
      "basis": "EXTENSIVE_REACTOR_AMOUNT",
      "model_level": 2,
      "site_family_id": "SITE-A",
      "terminal_id": null,
      "nonnegative": true,
      "conserved_inventory_id": "SITE_TOTAL:SITE-A"
    },
    {
      "state_id": "N_SITE_INHIBITED_H2:SITE-A",
      "base_variable_id": "N_SITE_INHIBITED_H2",
      "index": 9,
      "unit": "mol",
      "basis": "EXTENSIVE_REACTOR_AMOUNT",
      "model_level": 2,
      "site_family_id": "SITE-A",
      "terminal_id": null,
      "nonnegative": true,
      "conserved_inventory_id": "SITE_TOTAL:SITE-A"
    },
    {
      "state_id": "N_SITE_POISONED:SITE-A",
      "base_variable_id": "N_SITE_POISONED",
      "index": 10,
      "unit": "mol",
      "basis": "EXTENSIVE_REACTOR_AMOUNT",
      "model_level": 2,
      "site_family_id": "SITE-A",
      "terminal_id": null,
      "nonnegative": true,
      "conserved_inventory_id": "SITE_TOTAL:SITE-A"
    },
    {
      "state_id": "N_SITE_DEAD:SITE-A",
      "base_variable_id": "N_SITE_DEAD",
      "index": 11,
      "unit": "mol",
      "basis": "EXTENSIVE_REACTOR_AMOUNT",
      "model_level": 2,
      "site_family_id": "SITE-A",
      "terminal_id": null,
      "nonnegative": true,
      "conserved_inventory_id": "SITE_TOTAL:SITE-A"
    },
    {
      "state_id": "LAMBDA0:SITE-A:E",
      "base_variable_id": "LAMBDA0",
      "index": 12,
      "unit": "mol",
      "basis": "EXTENSIVE_REACTOR_AMOUNT",
      "model_level": 2,
      "site_family_id": "SITE-A",
      "terminal_id": "E",
      "nonnegative": true,
      "conserved_inventory_id": "SITE_TOTAL:SITE-A"
    },
    {
      "state_id": "LAMBDA0:SITE-A:P",
      "base_variable_id": "LAMBDA0",
      "index": 13,
      "unit": "mol",
      "basis": "EXTENSIVE_REACTOR_AMOUNT",
      "model_level": 2,
      "site_family_id": "SITE-A",
      "terminal_id": "P",
      "nonnegative": true,
      "conserved_inventory_id": "SITE_TOTAL:SITE-A"
    },
    {
      "state_id": "LAMBDA0:SITE-A:D",
      "base_variable_id": "LAMBDA0",
      "index": 14,
      "unit": "mol",
      "basis": "EXTENSIVE_REACTOR_AMOUNT",
      "model_level": 2,
      "site_family_id": "SITE-A",
      "terminal_id": "D",
      "nonnegative": true,
      "conserved_inventory_id": "SITE_TOTAL:SITE-A"
    },
    {
      "state_id": "LAMBDA1:SITE-A:E",
      "base_variable_id": "LAMBDA1",
      "index": 15,
      "unit": "mol",
      "basis": "EXTENSIVE_REACTOR_AMOUNT",
      "model_level": 2,
      "site_family_id": "SITE-A",
      "terminal_id": "E",
      "nonnegative": true,
      "conserved_inventory_id": null
    },
    {
      "state_id": "LAMBDA1:SITE-A:P",
      "base_variable_id": "LAMBDA1",
      "index": 16,
      "unit": "mol",
      "basis": "EXTENSIVE_REACTOR_AMOUNT",
      "model_level": 2,
      "site_family_id": "SITE-A",
      "terminal_id": "P",
      "nonnegative": true,
      "conserved_inventory_id": null
    },
    {
      "state_id": "LAMBDA1:SITE-A:D",
      "base_variable_id": "LAMBDA1",
      "index": 17,
      "unit": "mol",
      "basis": "EXTENSIVE_REACTOR_AMOUNT",
      "model_level": 2,
      "site_family_id": "SITE-A",
      "terminal_id": "D",
      "nonnegative": true,
      "conserved_inventory_id": null
    },
    {
      "state_id": "MU0:SITE-A",
      "base_variable_id": "MU0",
      "index": 18,
      "unit": "mol",
      "basis": "EXTENSIVE_REACTOR_AMOUNT",
      "model_level": 2,
      "site_family_id": "SITE-A",
      "terminal_id": null,
      "nonnegative": true,
      "conserved_inventory_id": null
    },
    {
      "state_id": "MU1:SITE-A",
      "base_variable_id": "MU1",
      "index": 19,
      "unit": "mol",
      "basis": "EXTENSIVE_REACTOR_AMOUNT",
      "model_level": 2,
      "site_family_id": "SITE-A",
      "terminal_id": null,
      "nonnegative": true,
      "conserved_inventory_id": null
    }
  ],
  "digest_sha256": "718abd62985f3bf7224c41ed633c402f6dc5283b079f5d974dbd07ca22fed810",
  "numerical_execution": "NOT_IMPLEMENTED_PHASE_A2"
}
